INSERT INTO report_inscents (incident_number, registration_time, service, short_description, applicant, priority, executor, decision_time, status) VALUES
-- Сегодня (01.09.2025) - попадает в период "За 1 день"
(1001, '2025-09-01 09:30', 'CRM система', 'Проблема с доступом к модулю клиентов', 'Иванов И.И.', 1, 'Петров П.П.', '2025-09-01 10:45', 3),

-- Вчера (31.08.2025) - попадает в период "Три месяца" и "Месяц"
(1002, '2025-08-31 14:20', 'Почтовый сервер', 'Не приходят входящие письма', 'Сидоров А.В.', 2, 'Козлов М.С.', '2025-08-31 16:30', 3),

-- 5 дней назад (27.08.2025) - попадает в период "Три месяца" и "Месяц"
(1003, '2025-08-27 11:15', 'База данных', 'Медленная работа запросов', 'Попова О.Л.', 1, 'Смирнов Д.А.', '2025-08-27 13:40', 3),

-- 2 недели назад (18.08.2025) - попадает в период "Три месяца" и "Месяц"
(1004, '2025-08-18 16:45', 'Веб-сайт', 'Ошибка 500 на главной странице', 'Кузнецов Р.Н.', 2, 'Орлова Е.П.', '2025-08-18 18:20', 3),

-- 1 месяц назад (01.08.2025) - попадает в период "Три месяца" и "Месяц"
(1005, '2025-08-01 10:00', 'Мобильное приложение', 'Крах приложения при запуске', 'Федоров С.М.', 1, 'Никитин А.Б.', '2025-08-01 12:30', 3),

-- 2 месяца назад (01.07.2025) - попадает в период "Три месяца"
(1006, '2025-07-01 13:25', 'Система отчетности', 'Не генерируются PDF отчеты', 'Захарова Т.В.', 2, 'Белов И.К.', '2025-07-01 15:45', 3),

-- 3 месяца назад (01.06.2025) - попадает в период "Три месяца"
(1007, '2025-06-01 08:40', 'Сервер авторизации', 'Ошибка аутентификации пользователей', 'Громов П.С.', 1, 'Соколова М.Д.', '2025-06-01 11:20', 3),

-- 4 месяца назад (01.05.2025) - не попадает в "Три месяца", только в "Весь период"
(1008, '2025-05-01 15:30', 'Файловое хранилище', 'Не загружаются файлы больше 10МБ', 'Тихонов В.Р.', 2, 'Павлова А.Н.', '2025-05-01 17:50', 3),

-- 6 месяцев назад (01.03.2025) - не попадает в "Три месяца", только в "Весь период"
(1009, '2025-03-01 12:10', 'Система бронирования', 'Дублирование бронирований', 'Морозова Л.К.', 1, 'Виноградов С.П.', '2025-03-01 14:35', 3),

-- 1 год назад (01.09.2024) - не попадает в "Три месяца", только в "Весь период"
(1010, '2024-09-01 09:00', 'Платежная система', 'Ошибка при обработке платежей', 'Семенов Д.Л.', 1, 'Ковалева И.С.', '2024-09-01 11:45', 3);